{
  "human_decision_ref": {
    "digest": "sha256:fb81f647a9a575dd97a598c9d346fa6d9c60c70da413134b3e218af83f448ad8",
    "id": "hum_fb81f647a9a575dd97a598c9d346fa6d"
  },
  "implementer_assignment_ref": {
    "digest": "sha256:58353a808270d002a61728f3b532bae3e7505c500ad8c4b4663cd3286f3849e6",
    "id": "asg_58353a808270d002a61728f3b532bae3"
  },
  "metadata": {
    "fixture_only": true,
    "note": "Planning/conformance fixture; not production qualification or provider evidence."
  },
  "patch_decision_ref": {
    "digest": "sha256:dbd59834f38b5227bd61cd49eb7ffd3e7075f65f4504d800c5e3c35e4be2a35d",
    "id": "dec_dbd59834f38b5227bd61cd49eb7ffd3e"
  },
  "patch_ref": {
    "digest": "sha256:5d4a5e68e8e1b6a0be5eebf194e78da635168229d3a857291dbdf9551eb058b7",
    "id": "pat_5d4a5e68e8e1b6a0be5eebf194e78da6"
  },
  "plan_ref": {
    "digest": "sha256:48e474ac89fbe3d9498c83fb6d4254ba41677246fcbcc6f0be352bc25c852118",
    "id": "pln_48e474ac89fbe3d9498c83fb6d4254ba"
  },
  "projection_id": "prj_0c3c4182908fa4f72327e3ed6bcf3a24",
  "review_ref": {
    "digest": "sha256:bbd0d94ecb125f2caa587bd8ab4c33bbf9dc60540d17636ba2b883fb652cd3d3",
    "id": "rev_bbd0d94ecb125f2caa587bd8ab4c33bb"
  },
  "reviewer_assignment_ref": {
    "digest": "sha256:25bf8224367a8c0d6ec4fc1d6584d8be1c8339efdf3db771d49b46060075f159",
    "id": "asg_25bf8224367a8c0d6ec4fc1d6584d8be"
  },
  "run_result_ref": {
    "digest": "sha256:19c68dd58b4de8c66f340a435570073721579e3683a0169718ea584a0fa9440b",
    "id": "run_00112233445566778899aabbccddeeff"
  },
  "schema": "engineering-system/run-result-projection/m0-v1",
  "semantic_digest": "sha256:0c3c4182908fa4f72327e3ed6bcf3a2449e4fa4ff9b1f814097a04dcea37752f",
  "truth": {
    "human_status": "ACCEPT",
    "review_status": "APPROVE",
    "run_status": "completed",
    "unknown_effects": [],
    "verification_status": "PASS"
  },
  "verification_ref": {
    "digest": "sha256:ca3c60dcb20fa8cd04df7b8662d5183e7693ea2f2bd4b2b640973058d64038f7",
    "id": "ver_ca3c60dcb20fa8cd04df7b8662d5183e"
  }
}
